{
  "$schema": "https://json-schema.org/draft/2020-12/schema",
  "type": "object",
  "properties": {
    "index": {
      "type": "string"
    },
    "name": {
      "type": "string"
    },
    "equipment": {
      "type": "array",
      "items": {
        "type": "object",
        "properties": {
          "index": {
            "type": "string"
          },
          "name": {
            "type": "string"
          },
          "url": {
            "type": "string"
          },
          "note": {
            "type": "string"
          }
        },
        "required": [
          "index",
          "name",
          "url"
        ],
        "additionalProperties": false
      }
    },
    "url": {
      "type": "string"
    }
  },
  "required": [
    "index",
    "name",
    "equipment",
    "url"
  ],
  "additionalProperties": false
}
